title,year,rating,movie_poster_str,movie_summary,user_rating_count,user_review_count,critic_review_count,movie_mpaa_rating,movie_runtime,movie_genres,movie_release_date,box_office_gross_domestic,box_office_gross_intl,url
Nosferatu the Vampyre,1979,7.5,"https://m.media-amazon.com/images/M/MV5BNDYxYWY3ZTUtNzNiMi00ZmQyLTliMzAtNDdiZGY1NzVjZTc3XkEyXkFqcGdeQXVyMTQxNzMzNDI@._V1_UX182_CR0,0,182,268_AL_.jpg","Count Dracula moves from Transylvania to Wismar, spreading the Black Plague across the land. Only a woman pure of heart can bring an end to his reign of horror.",29676,186,178,PG,107,"Drama, Horror",17 January 1979 (France),--,--,https://www.imdb.com/title/tt0079641/
Oculus,2013,6.5,"https://m.media-amazon.com/images/M/MV5BMzE1NzM4MjEyNV5BMl5BanBnXkFtZTgwMjYzMjMzMTE@._V1_UX182_CR0,0,182,268_AL_.jpg","A woman tries to exonerate her brother, who was convicted of murder, by proving that the crime was committed by a supernatural phenomenon.",109331,427,355,R,104,"Horror, Mystery",11 April 2014 (USA),27695246,44043910,https://www.imdb.com/title/tt2388715/
Open Water,2003,5.7,"https://m.media-amazon.com/images/M/MV5BNjQ5ODAyOTk3OF5BMl5BanBnXkFtZTcwNzQ1NjYyMQ@@._V1_UX182_CR0,0,182,268_AL_.jpg",Based on the true story of two scuba divers accidentally stranded in shark infested waters after their tour boat has left.,48970,945,235,R,79,"Adventure, Drama, Horror",20 August 2004 (USA),54667954,--,https://www.imdb.com/title/tt0374102/
Ouija,2016,6.1,"https://m.media-amazon.com/images/M/MV5BMTk4NTcxNTQ5NF5BMl5BanBnXkFtZTgwNTk5OTU4OTE@._V1_UX182_CR0,0,182,268_AL_.jpg","In 1967 Los Angeles, a widowed mother and her daughters add a new stunt to bolster their seance scam business by inviting an evil presence into their home, not realizing how dangerous it is.",48973,174,227,PG-13,99,"Drama, Horror, Mystery",21 October 2016 (USA),35144505,81705746,https://www.imdb.com/title/tt4361050/
Peeping Tom,1960,7.7,"https://m.media-amazon.com/images/M/MV5BZjM3ZTAzZDYtZmFjZS00YmQ1LWJlOWEtN2I4MDRmYzY5YmRlL2ltYWdlXkEyXkFqcGdeQXVyMjgyNjk3MzE@._V1_UX182_CR0,0,182,268_AL_.jpg","A young man murders women, using a movie camera to film their dying expressions of terror.",27807,159,112,Not Rated,101,"Drama, Horror, Thriller",December 1961 (USA),--,--,https://www.imdb.com/title/tt0054167/
Pet Sematary,2019,5.8,"https://m.media-amazon.com/images/M/MV5BMjJiN2UwYWItNWJjNi00Zjg4LWE5NmItMmM4N2I3ZjY3OTY2XkEyXkFqcGdeQXVyODQxMTI4MjM@._V1_UX182_CR0,0,182,268_AL_.jpg","Dr. Louis Creed and his wife, Rachel, relocate from Boston to rural Maine with their two young children. The couple soon discover a mysterious burial ground hidden deep in the woods near their new home.",60909,1014,304,R,101,"Horror, Mystery, Thriller",5 April 2019 (USA),54724696,112399944,https://www.imdb.com/title/tt0837563/
Phantasm,1979,6.8,"https://m.media-amazon.com/images/M/MV5BZTdmN2RkODEtODM4ZS00ZGRlLTliMTYtYmZmZWZkMTZmODYxL2ltYWdlL2ltYWdlXkEyXkFqcGdeQXVyMTQxNzMzNDI@._V1_UX182_CR0,0,182,268_AL_.jpg","A teenage boy and his friends face off against a mysterious grave robber known only as the Tall Man, who keeps a lethal arsenal of terrible weapons with him.",29328,295,220,R,88,"Horror, Sci-Fi",28 March 1979 (USA),11988469,--,https://www.imdb.com/title/tt0079714/
Poison Ivy,1992,5.4,"https://m.media-amazon.com/images/M/MV5BZTgzNTZhODktZjE4Ny00ZDIwLWE3NjEtOTVmMWM0Nzc5YzZmXkEyXkFqcGdeQXVyMTQxNzMzNDI@._V1_UX182_CR0,0,182,268_AL_.jpg",A seductive teen befriends an introverted high school student and schemes her way into the lives of her wealthy family.,16292,61,31,R,88,"Drama, Thriller",8 May 1992 (USA),1829804,--,https://www.imdb.com/title/tt0105156/
Poltergeist,1982,7.3,"https://m.media-amazon.com/images/M/MV5BNzliZmRlYTctYmNkYS00NzE5LWI1OWQtMTRiODY5MDMwMTVkXkEyXkFqcGdeQXVyMTQxNzMzNDI@._V1_UX182_CR0,0,182,268_AL_.jpg",A family's home is haunted by a host of demonic ghosts.,132566,375,250,PG,114,"Horror, Thriller",4 June 1982 (USA),77142388,--,https://www.imdb.com/title/tt0084516/
Pontypool,2008,6.6,"https://m.media-amazon.com/images/M/MV5BNWZkMmNmNGItM2MwNC00YTY2LTk0ZDYtMGM0YjM5Nzk0MjVjXkEyXkFqcGdeQXVyMTQxNzMzNDI@._V1_UX182_CR0,0,182,268_AL_.jpg",A radio host interprets the possible outbreak of a deadly virus which infects the small Ontario town he is stationed in.,27380,174,189,Not Rated,93,"Fantasy, Horror, Thriller",18 September 2009 (Turkey),32118,--,https://www.imdb.com/title/tt1226681/
Pooh's Heffalump Halloween Movie,2005,6.5,"https://m.media-amazon.com/images/M/MV5BNDU5Nzc5NTY3N15BMl5BanBnXkFtZTcwNjA3ODkyMQ@@._V1_UY268_CR3,0,182,268_AL_.jpg","Your favorite friends from The Hundred Acre Wood are back in the all-new original feature, POOH'S HEFFALUMP HALLOWEEN MOVIE. It's a hilariously haunted Halloween in the Hundred Acre Wood, ...
                    See full summary »",797,8,13,G,--,"Animation, Comedy, Family",13 September 2005,--,1.33 : 1,https://www.imdb.com/title/tt0457437/
Practical Magic,1998,6.3,"https://m.media-amazon.com/images/M/MV5BMzU4MmNkNGYtN2I1Zi00ZDEzLTlmZjItNWQ5NWI0NzcwZDQxXkEyXkFqcGdeQXVyMTQxNzMzNDI@._V1_UX182_CR0,0,182,268_AL_.jpg","Two witch sisters, raised by their eccentric aunts in a small town, face closed-minded prejudice and a curse which threatens to prevent them ever finding lasting love.",67532,275,97,PG-13,104,"Comedy, Drama, Fantasy",16 October 1998 (USA),46732881,46732881,https://www.imdb.com/title/tt0120791/
Prevenge,2016,5.9,"https://m.media-amazon.com/images/M/MV5BMzA3MjQ0NTc2OF5BMl5BanBnXkFtZTgwNjAyNzU3MTI@._V1_UX182_CR0,0,182,268_AL_.jpg","Widow Ruth is seven months pregnant when, believing herself to be guided by her unborn baby, she embarks on a homicidal rampage, dispatching anyone who stands in her way.",5813,38,124,TV-MA,88,"Comedy, Drama, Fantasy",24 March 2017 (USA),--,--,https://www.imdb.com/title/tt5154288/
Psycho,1960,8.5,"https://m.media-amazon.com/images/M/MV5BNTQwNDM1YzItNDAxZC00NWY2LTk0M2UtNDIwNWI5OGUyNWUxXkEyXkFqcGdeQXVyNzkwMjQ5NzM@._V1_UX182_CR0,0,182,268_AL_.jpg","A Phoenix secretary embezzles forty thousand dollars from her employer's client, goes on the run, and checks into a remote motel run by a young man under the domination of his mother.",554191,1187,231,R,109,"Horror, Mystery, Thriller",8 September 1960 (USA),--,--,https://www.imdb.com/title/tt0054215/
Rare Exports,2010,6.7,"https://m.media-amazon.com/images/M/MV5BMTM4NzkxMDM4N15BMl5BanBnXkFtZTcwMTI1NzQwNA@@._V1_UY268_CR3,0,182,268_AL_.jpg","In the depths of the Korvatunturi mountains, 486 meters deep, lies the closest ever guarded secret of Christmas. The time has come to dig it up. This Christmas everyone will believe in Santa Claus.",24173,86,243,R,84,"Adventure, Fantasy, Horror",3 December 2010 (Finland),236347,4015133,https://www.imdb.com/title/tt1401143/
Re-Animator,1985,7.2,"https://m.media-amazon.com/images/M/MV5BNDRjNjRlNmYtZGVkOS00ODA1LWFmMTEtZmY1MWY5ZGM5OWUxXkEyXkFqcGdeQXVyMTQxNzMzNDI@._V1_UX182_CR0,0,182,268_AL_.jpg","After an odd new medical student arrives on campus, a dedicated local and his girlfriend become involved in bizarre experiments centering around the re-animation of dead tissue.",51347,216,182,Unrated,86,"Comedy, Horror, Sci-Fi",18 October 1985 (USA),2023414,2023414,https://www.imdb.com/title/tt0089885/
Ready or Not,2019,7.1,"https://m.media-amazon.com/images/M/MV5BYzBkMzAyMDUtZTFkZS00OWUyLTgwM2ItNGI3MTQ5NzA3NTVkXkEyXkFqcGdeQXVyMTkxNjUyNQ@@._V1_UX182_CR0,0,182,268_AL_.jpg",A bride's wedding night takes a sinister turn when her eccentric new in-laws force her to take part in a terrifying game.,19605,338,263,R,95,"Comedy, Horror, Mystery",21 August 2019 (USA),28714231,56828752,https://www.imdb.com/title/tt7798634/
Repulsion,1965,7.7,"https://m.media-amazon.com/images/M/MV5BZTU5ZThjNzAtNjc4NC00OTViLWIxYTYtODFmMTk5Y2NjZjZiL2ltYWdlL2ltYWdlXkEyXkFqcGdeQXVyNjc1NTYyMjg@._V1_UX182_CR0,0,182,268_AL_.jpg",A sex-repulsed woman who disapproves of her sister's boyfriend sinks into depression and has horrific visions of rape and violence.,44885,229,171,Not Rated,105,"Drama, Horror, Thriller",3 October 1965 (USA),--,--,https://www.imdb.com/title/tt0059646/
Return to Oz,1985,6.7,"https://m.media-amazon.com/images/M/MV5BNmM1YmM1NjAtNTlhMC00YjJiLTlkNjctZmVjYjIyMTRiMzBlXkEyXkFqcGdeQXVyMjM0ODk5MDU@._V1_UX182_CR0,0,182,268_AL_.jpg","Dorothy, saved from a psychiatric experiment by a mysterious girl, is somehow called back to Oz when a vain witch and the Nome King destroy everything that makes the magical land beautiful.",22830,220,68,PG,113,"Adventure, Family, Fantasy",21 June 1985 (USA),11137801,11137801,https://www.imdb.com/title/tt0089908/
Revenge,2017,6.3,"https://m.media-amazon.com/images/M/MV5BNzZhZjJlNzMtZmVlNi00MTIxLTg3OTMtMTI2NTVkYWQ4NDQyXkEyXkFqcGdeQXVyMTMxODk2OTU@._V1_UX182_CR0,0,182,268_AL_.jpg","Never take your mistress on an annual guys' getaway, especially one devoted to hunting - a violent lesson for three wealthy married men.",29508,345,213,R,108,"Action, Horror, Thriller",11 May 2018 (USA),913331,--,https://www.imdb.com/title/tt6738136/
Ringu,1998,7.2,"https://m.media-amazon.com/images/M/MV5BYTA0ZmE4NWUtNTgzZS00ZmE0LWFlNjItNzFkMWVmOGQxNGY3L2ltYWdlXkEyXkFqcGdeQXVyNTAyODkwOQ@@._V1_UX182_CR0,0,182,268_AL_.jpg",A reporter and her ex-husband investigate a cursed video tape that is rumored to kill the viewer seven days after watching it.,59726,412,166,Not Rated,96,"Horror, Mystery",31 January 1998 (Japan),--,--,https://www.imdb.com/title/tt0178868/
Room on the Broom,2012,7.6,"https://m.media-amazon.com/images/M/MV5BNDg3Njg4ODEyMl5BMl5BanBnXkFtZTgwMTM3MzcxMTE@._V1_UX182_CR0,0,182,268_AL_.jpg","To the annoyance of her cat a kindly witch allows a dog, a bird and a frog who have helped her retrieve things she has lost to ride on her broomstick, making it top heavy. The broom is ...
                    See full summary »",3102,18,12,Not Rated,25,"Animation, Short, Comedy",30 October 2013,--,--,https://www.imdb.com/title/tt2484120/
Sam gang 2,2004,7.0,"https://m.media-amazon.com/images/M/MV5BNzM5MTM2OTgzOF5BMl5BanBnXkFtZTcwNzc4NTUzMQ@@._V1_UX182_CR0,0,182,268_AL_.jpg",An Asian cross-cultural trilogy of horror films from accomplished indie directors.,17918,80,128,R,118,Horror,20 August 2004 (South Korea),--,--,https://www.imdb.com/title/tt0420251/
Scanners,1981,6.8,"https://m.media-amazon.com/images/M/MV5BMjQwNDE0MDM0NV5BMl5BanBnXkFtZTgwOTU0ODgwNzE@._V1_UX182_CR0,0,182,268_AL_.jpg",A scientist sends a man with extraordinary psychic powers to hunt others like him.,44158,185,130,R,103,"Horror, Sci-Fi, Thriller",14 January 1981 (USA),--,--,https://www.imdb.com/title/tt0081455/
Scary Movie,2000,6.2,"https://m.media-amazon.com/images/M/MV5BMGEzZjdjMGQtZmYzZC00N2I4LThiY2QtNWY5ZmQ3M2ExZmM4XkEyXkFqcGdeQXVyMTQxNzMzNDI@._V1_UX182_CR0,0,182,268_AL_.jpg","A year after disposing of the body of a man they accidentally killed, a group of dumb teenagers are stalked by a bumbling serial killer.",219229,903,104,R,88,Comedy,7 July 2000 (USA),157019771,278019771,https://www.imdb.com/title/tt0175142/
Scary Stories to Tell in the Dark,2019,6.2,"https://m.media-amazon.com/images/M/MV5BNjNiM2E3NDItNGU5NS00N2UwLTk2YWItZWRmMGFlNjJhYzE3XkEyXkFqcGdeQXVyOTQ5MTIwMjM@._V1_UY268_CR4,0,182,268_AL_.jpg","On Halloween 1968, reclusive Stella and her two friends meet a mysterious drifter, Ramón, and uncover a sinister notebook of stories.",29677,460,228,PG-13,108,"Horror, Mystery, Thriller",9 August 2019 (USA),68947075,95677760,https://www.imdb.com/title/tt3387520/
Scooby-Doo on Zombie Island,1998,7.7,"https://m.media-amazon.com/images/M/MV5BNzA1ZmMyYjUtMjMzOS00NGRmLTkzMzQtZmVmN2ExMWI1NjJiXkEyXkFqcGdeQXVyNjg1MDQzMzc@._V1_UY268_CR7,0,182,268_AL_.jpg","The Mystery Gang reunite and visit Moonscar Island, a remote island with a dark secret. Daphne wants more than just a villain in a costume, and they get more than they ever expected.",9996,67,13,TV-G,77,"Animation, Adventure, Comedy",22 September 1998,--,--,https://www.imdb.com/title/tt0166792/
Scream,1996,7.2,"https://m.media-amazon.com/images/M/MV5BMjA2NjU5MTg5OF5BMl5BanBnXkFtZTgwOTkyMzQxMDE@._V1_UX182_CR0,0,182,268_AL_.jpg","A year after the murder of her mother, a teenage girl is terrorized by a new killer, who targets the girl and her friends by using horror films as part of a deadly game.",267869,937,254,R,111,"Horror, Mystery",20 December 1996 (USA),103046663,173046663,https://www.imdb.com/title/tt0117571/
Scream 2,1997,6.2,"https://m.media-amazon.com/images/M/MV5BMDNlM2E2OTUtZTRhZi00ZDU1LWIxODAtN2E5OGZiNmIwMDIwXkEyXkFqcGdeQXVyMTQxNzMzNDI@._V1_UX182_CR0,0,182,268_AL_.jpg","Two years after the first series of murders, as Sydney acclimates to college life, someone donning the Ghostface costume begins a new string of killings.",147805,506,205,R,120,"Horror, Mystery",12 December 1997 (USA),101363301,172363301,https://www.imdb.com/title/tt0120082/
Scream 4,2011,6.1,"https://m.media-amazon.com/images/M/MV5BMTk5OTcxNTUyNF5BMl5BanBnXkFtZTcwMDczMzE0NA@@._V1_UX182_CR0,0,182,268_AL_.jpg","Ten years have passed, and Sidney Prescott, who has put herself back together thanks in part to her writing, is visited by the Ghostface Killer.",120950,542,428,R,111,"Horror, Mystery",15 April 2011 (USA),38180928,97231420,https://www.imdb.com/title/tt1262416/
Secret Obsession,2019,4.3,"https://m.media-amazon.com/images/M/MV5BMjRjNmUyMjEtZjllNS00YWU5LTlkZjgtNWE2MzNhMzIwNTljXkEyXkFqcGdeQXVyMTkxNjUyNQ@@._V1_UX182_CR0,0,182,268_AL_.jpg","Recuperating from trauma, Jennifer remains in danger as she returns to a life she doesn't remember.",14059,668,30,TV-14,97,"Drama, Mystery, Thriller",18 July 2019 (USA),--,--,https://www.imdb.com/title/tt9419834/
Shadow of the Vampire,2000,6.9,"https://m.media-amazon.com/images/M/MV5BMGYxZDEzMDMtMDIzNy00OTQ5LTkzYmItYzdkYTgxMGRkOWVmXkEyXkFqcGdeQXVyMTQxNzMzNDI@._V1_UX182_CR0,0,182,268_AL_.jpg",The filming of Nosferatu (1922) is hampered by the fact that its star Max Schreck is taking the role of a vampire far more seriously than seems humanly possible.,38524,333,208,R,92,"Drama, Horror",26 January 2001 (USA),11155214,--,https://www.imdb.com/title/tt0189998/
Shaun of the Dead,2004,7.9,"https://m.media-amazon.com/images/M/MV5BMTg5Mjk2NDMtZTk0Ny00YTQ0LWIzYWEtMWI5MGQ0Mjg1OTNkXkEyXkFqcGdeQXVyNzkwMjQ5NzM@._V1_UX182_CR0,0,182,268_AL_.jpg",A man's uneventful life is disrupted by the zombie apocalypse.,480425,928,262,R,99,"Comedy, Horror",24 September 2004 (USA),13542874,30039392,https://www.imdb.com/title/tt0365748/
Sisters,1972,6.9,"https://m.media-amazon.com/images/M/MV5BMDljZDliM2YtMjNlMS00ZjY2LWFjNjctMDU5ZmU0NjhhZjk0XkEyXkFqcGdeQXVyMjI4MjA5MzA@._V1_UX182_CR0,0,182,268_AL_.jpg","A fledgling Staten Island journalist witnesses a brutal murder in the neighboring apartment of a French-Canadian model, but the police do not believe that the crime took place. With the help of a private detective, she seeks out the truth.",13821,128,143,R,93,"Horror, Mystery, Thriller",26 March 1973 (USA),--,--,https://www.imdb.com/title/tt0070698/
Sleepy Hollow,1999,7.3,"https://m.media-amazon.com/images/M/MV5BMTQ4Yjk5ODEtNGFkOS00OTY1LTgwYTYtOTFkNmU2NzBmNGM2XkEyXkFqcGdeQXVyNDQ2MTMzODA@._V1_UX182_CR0,0,182,268_AL_.jpg","Ichabod Crane is sent to Sleepy Hollow to investigate the decapitations of three people, with the culprit being the legendary apparition, The Headless Horseman.",311512,1014,260,R,105,"Fantasy, Horror, Mystery",19 November 1999 (USA),206071502,--,https://www.imdb.com/title/tt0162661/
Slither,2006,6.4,"https://m.media-amazon.com/images/M/MV5BMjEyNTE0NDI2OF5BMl5BanBnXkFtZTcwODcwODMzMQ@@._V1_UX182_CR0,0,182,268_AL_.jpg","A small town is taken over by an alien plague, turning residents into zombies and all forms of mutant monsters.",70683,370,267,R,95,"Comedy, Horror, Sci-Fi",31 March 2006 (USA),7802450,12834936,https://www.imdb.com/title/tt0439815/
Something Wicked This Way Comes,1983,6.8,"https://m.media-amazon.com/images/M/MV5BZjAwNWM2ZjItMTgwYi00YjMzLTkyZjEtYTU2YjFiODkzMjA5XkEyXkFqcGdeQXVyNTAyODkwOQ@@._V1_UX182_CR0,0,182,268_AL_.jpg","In a small American town, a diabolical circus and its demonic proprietor prey on the townsfolk.",7803,81,58,PG,95,"Fantasy, Mystery, Thriller",29 April 1983 (USA),8400000,8400000,https://www.imdb.com/title/tt0086336/
Southbound,2015,5.9,"https://m.media-amazon.com/images/M/MV5BMTU1NDg3NjE5MF5BMl5BanBnXkFtZTgwNzQxNjA3NzE@._V1_UX182_CR0,0,182,268_AL_.jpg",Five interlocking tales of terror follow the fates of a group of weary travellers who confront their worst nightmares - and darkest secrets - over one long night on a desolate stretch of desert highway.,14902,86,154,R,89,"Fantasy, Horror, Thriller",9 February 2016 (USA),35275,--,https://www.imdb.com/title/tt4935334/
Suspiria,1977,7.4,"https://m.media-amazon.com/images/M/MV5BMjRiYTNjODctNGU1Ni00NDg3LTk0NGUtMWU0NjgyZTAyYmNjXkEyXkFqcGdeQXVyMTQxNzMzNDI@._V1_UX182_CR0,0,182,268_AL_.jpg",An American newcomer to a prestigious German ballet academy comes to realize that the school is a front for something sinister amid a series of grisly murders.,71274,585,259,R,99,Horror,12 August 1977 (USA),--,--,https://www.imdb.com/title/tt0076786/
Teeth,2007,5.4,"https://m.media-amazon.com/images/M/MV5BZjVjMjY4MzMtYzljNi00NDQ5LTk3NTYtNzY5NzYyY2FjZTZmXkEyXkFqcGdeQXVyMTQxNzMzNDI@._V1_UX182_CR0,0,182,268_AL_.jpg","Still a stranger to her own body, a high school student discovers she has a physical advantage when she becomes the object of male violence.",39747,176,225,R,94,"Comedy, Fantasy, Horror",3 April 2008 (Singapore),2340110,--,https://www.imdb.com/title/tt0780622/
The Abominable Dr. Phibes,1971,7.1,"https://m.media-amazon.com/images/M/MV5BMWIwYjc5ZjEtZGI0Mi00ODVjLWFhODAtOWU3N2Q5NmNlZDFjXkEyXkFqcGdeQXVyMTQxNzMzNDI@._V1_UX182_CR0,0,182,268_AL_.jpg","A doctor, scientist, organist, and biblical scholar, Anton Phibes, seeks revenge on the nine doctors he considers responsible for his wife's death.",12536,131,105,PG-13,94,"Comedy, Horror",18 May 1971 (USA),--,--,https://www.imdb.com/title/tt0066740/
The Addams Family,1991,6.9,"https://m.media-amazon.com/images/M/MV5BODc1NmY0MDUtNjUzNS00ODdhLWJlN2ItMTgwZjczZjI0MDkyXkEyXkFqcGdeQXVyNTAyODkwOQ@@._V1_UY268_CR11,0,182,268_AL_.jpg",Con artists plan to fleece an eccentric family using an accomplice who claims to be their long-lost uncle.,119819,149,71,PG-13,99,"Comedy, Fantasy",22 November 1991 (USA),113502426,191502426,https://www.imdb.com/title/tt0101272/
The Babadook,2014,6.8,"https://m.media-amazon.com/images/M/MV5BMTk0NzMzODc2NF5BMl5BanBnXkFtZTgwOTYzNTM1MzE@._V1_UX182_CR0,0,182,268_AL_.jpg","A single mother and her child fall into a deep well of paranoia when an eerie children's book titled ""Mister Babadook"" manifests in their home.",178540,800,503,Not Rated,94,"Drama, Horror",28 November 2014 (USA),964413,10312540,https://www.imdb.com/title/tt2321549/
The Bird with the Crystal Plumage,1970,7.2,"https://m.media-amazon.com/images/M/MV5BNzU1ZTQwY2EtZDc5YS00ZmMxLWE2MGItZjA2ZTc0OTFjYWY1XkEyXkFqcGdeQXVyNjc1NTYyMjg@._V1_UY268_CR5,0,182,268_AL_.jpg","An American expatriate in Rome witnesses an attempted murder. He learns later that it's connected to an ongoing murder spree in the city, and decides to do his own investigation, despite being personally targeted by the killer.",16128,107,125,GP,96,"Horror, Mystery, Thriller",12 June 1970 (USA),--,--,https://www.imdb.com/title/tt0065143/
The Birds,1963,7.7,"https://m.media-amazon.com/images/M/MV5BMTAxNDA1ODc5MDleQTJeQWpwZ15BbWU4MDg2MDA4OTEx._V1_UX182_CR0,0,182,268_AL_.jpg",A wealthy San Francisco socialite pursues a potential boyfriend to a small Northern California town that slowly takes a turn for the bizarre when birds of all kinds suddenly begin to attack people.,158619,523,148,PG-13,119,"Drama, Horror, Mystery",29 March 1963 (USA),--,--,https://www.imdb.com/title/tt0056869/
The Black Cauldron,1985,6.4,"https://m.media-amazon.com/images/M/MV5BYjU4MDNmMTYtYzUyNS00ZmRmLWFiYTMtNzdiYjE0NTdlZDI0XkEyXkFqcGdeQXVyNzY1NDgwNjQ@._V1_UX182_CR0,0,182,268_AL_.jpg",A young boy and a bunch of misfit friends embark on a quest to find a dark magic item of ultimate power before a diabolical tyrant can.,28134,129,66,PG,80,"Animation, Action, Adventure",24 July 1985 (USA),21288692,21288692,https://www.imdb.com/title/tt0088814/
The Blair Witch Project,1999,6.5,"https://m.media-amazon.com/images/M/MV5BNzQ1NDBlNDItMDAyYS00YTI2LTgwMmYtMzAwMzg4NDFlM2ZmXkEyXkFqcGdeQXVyMTQxNzMzNDI@._V1_UX182_CR0,0,182,268_AL_.jpg","Three film students vanish after traveling into a Maryland forest to film a documentary on the local Blair Witch legend, leaving only their footage behind.",220473,3492,405,R,81,"Horror, Mystery",30 July 1999 (USA),140539099,248639099,https://www.imdb.com/title/tt0185937/
The Brood,1979,6.8,"https://m.media-amazon.com/images/M/MV5BMzY0YzY5N2MtZTI2MS00N2E0LWJiYzQtMWU4ZWFkN2MzNjlhXkEyXkFqcGdeQXVyMTQxNzMzNDI@._V1_UX182_CR0,0,182,268_AL_.jpg","A man tries to uncover an unconventional psychologist's therapy techniques on his institutionalized wife, amidst a series of brutal murders.",23182,139,128,R,92,"Horror, Sci-Fi",25 May 1979 (USA),--,--,https://www.imdb.com/title/tt0078908/
The Cabin in the Woods,2011,7.0,"https://m.media-amazon.com/images/M/MV5BNTUxNzYyMjg2N15BMl5BanBnXkFtZTcwMTExNzExNw@@._V1_UX182_CR0,0,182,268_AL_.jpg","Five friends go for a break at a remote cabin, where they get more than they bargained for, discovering the truth behind the cabin in the woods.",347144,1116,669,R,95,Horror,13 April 2012 (USA),42073277,94348403,https://www.imdb.com/title/tt1259521/
The Cabinet of Dr. Caligari,1920,8.1,"https://m.media-amazon.com/images/M/MV5BNWJiNGJiMTEtMGM3OC00ZWNlLTgwZTgtMzdhNTRiZjk5MTQ1XkEyXkFqcGdeQXVyMTMxODk2OTU@._V1_UY268_CR3,0,182,268_AL_.jpg","Hypnotist Dr. Caligari uses a somnambulist, Cesare, to commit murders.",51519,217,148,Not Rated,76,"Fantasy, Horror, Mystery",27 February 1920 (Germany),--,--,https://www.imdb.com/title/tt0010323/
The Cat o' Nine Tails,1971,6.7,"https://m.media-amazon.com/images/M/MV5BZTY3MjliZmYtZWUzMi00NDFkLThhYjgtNGFkNWUwOTFmM2QxXkEyXkFqcGdeQXVyNzc5MjA3OA@@._V1_UY268_CR5,0,182,268_AL_.jpg","A newspaper reporter and a retired, blind journalist try to solve a series of killings connected to a pharmaceutical company's experimental, top-secret research projects and in so doing, both become targets of the killer.",8756,80,128,GP,112,"Horror, Mystery, Thriller",21 May 1971 (USA),--,--,https://www.imdb.com/title/tt0065761/
The Conjuring,2013,7.5,"https://m.media-amazon.com/images/M/MV5BMTM3NjA1NDMyMV5BMl5BanBnXkFtZTcwMDQzNDMzOQ@@._V1_UX182_CR0,0,182,268_AL_.jpg",Paranormal investigators Ed and Lorraine Warren work to help a family terrorized by a dark presence in their farmhouse.,410871,1001,555,R,112,"Horror, Mystery, Thriller",19 July 2013 (USA),137400141,319494638,https://www.imdb.com/title/tt1457767/
The Conjuring 2,2016,7.3,"https://m.media-amazon.com/images/M/MV5BZjU5OWVlN2EtODNlYy00MjhhLWI0MDUtMTA3MmQ5MGMwYTZmXkEyXkFqcGdeQXVyNjE5MTM4MzY@._V1_UX182_CR0,0,182,268_AL_.jpg",Ed and Lorraine Warren travel to North London to help a single mother raising 4 children alone in a house plagued by a supernatural spirit.,204272,513,400,R,134,"Horror, Mystery, Thriller",10 June 2016 (USA),102470008,320392818,https://www.imdb.com/title/tt3065204/
The Craft,1996,6.3,"https://m.media-amazon.com/images/M/MV5BZTBkMWE1NGItZTgxMi00ZTE0LWIzZjAtNzQ5ZGZlZTQxN2EwXkEyXkFqcGdeQXVyMTQxNzMzNDI@._V1_UX182_CR0,0,182,268_AL_.jpg","A newcomer to a Catholic prep high school falls in with a trio of outcast teenage girls who practice witchcraft, and they all soon conjure up various spells and curses against those who anger them.",70299,213,114,R,101,"Drama, Fantasy, Horror",3 May 1996 (USA),24819936,--,https://www.imdb.com/title/tt0115963/
The Curse of La Llorona,2019,5.4,"https://m.media-amazon.com/images/M/MV5BNjU4NjU4ZDktOTg2Ny00MWI2LThiMTAtMGFkZGE1MWI5MzhjXkEyXkFqcGdeQXVyODQxMTI4MjM@._V1_UX182_CR0,0,182,268_AL_.jpg","Ignoring the eerie warning of a troubled mother suspected of child endangerment, a social worker and her own small kids are soon drawn into a frightening supernatural realm.",25860,448,204,R,93,"Horror, Mystery, Thriller",19 April 2019 (USA),54733739,122133739,https://www.imdb.com/title/tt4913966/
The Dark Crystal,1982,7.2,"https://m.media-amazon.com/images/M/MV5BNTU2MmJiZmQtZjBmMS00MTk4LWFmOWYtZGQzOTY5ODNjYWVhXkEyXkFqcGdeQXVyMTQxNzMzNDI@._V1_UX182_CR0,0,182,268_AL_.jpg","On another planet in the distant past, a Gelfling embarks on a quest to find the missing shard of a magical crystal, and so restore order to his world.",57345,267,112,PG,93,"Adventure, Family, Fantasy",17 December 1982 (USA),41357492,41373966,https://www.imdb.com/title/tt0083791/
The Dead Zone,1983,7.2,"https://m.media-amazon.com/images/M/MV5BMDk2ZGVkY2UtZGE0MS00NTY1LThiZjYtYjQxMTAwMjM5M2VlXkEyXkFqcGdeQXVyNTI4MjkwNjA@._V1_UX182_CR0,0,182,268_AL_.jpg",A man awakens from a coma to discover he has a psychic ability.,56084,212,93,R,103,"Drama, Horror, Sci-Fi",21 October 1983 (USA),20766616,--,https://www.imdb.com/title/tt0085407/
The Descent,2005,7.2,"https://m.media-amazon.com/images/M/MV5BMjA5NzQ1NTgwNV5BMl5BanBnXkFtZTcwNjUxMzUzMw@@._V1_UX182_CR0,0,182,268_AL_.jpg","A caving expedition goes horribly wrong, as the explorers become trapped and ultimately pursued by a strange breed of predators.",188564,1191,356,R,99,"Adventure, Horror, Thriller",4 August 2006 (USA),26024456,57130027,https://www.imdb.com/title/tt0435625/
The Devil's Backbone,2001,7.4,"https://m.media-amazon.com/images/M/MV5BZTI3MDcwZGItZDMwNS00ZDBjLWEwOGEtMWEyMWUxNDlkYzBjL2ltYWdlXkEyXkFqcGdeQXVyNTAyODkwOQ@@._V1_UY268_CR4,0,182,268_AL_.jpg","After Carlos - a 12-year-old whose father has died in the Spanish Civil War - arrives at an ominous boys' orphanage, he discovers the school is haunted and has many dark secrets which he must uncover.",58328,225,161,R,106,"Drama, Horror",20 April 2001 (Spain),6582065,--,https://www.imdb.com/title/tt0256009/
